Repo/Product,Category,Buyer,Pain Severity (1-5),Urgency (1-5),Willingness to Pay (1-5),Build Maturity (1-5),Demo Readiness (1-5),Sales Simplicity (1-5),Support Burden (1-5),Moat Potential (1-5),Fastest Revenue Path (1-5),Recommended GTM Motion,Next Action
EvidenceVault,Compliance Operations,SMBs/agencies/vendors needing compliance proof,4,4,4,5,5,4,3,4,4,Product-led growth with free trial,Create self-serve signup flow
Settler,Reconciliation Intelligence,Finance ops/marketplace/ecommerce with payout mismatch,5,5,4,5,5,3,2,4,4,Direct sales to finance teams,Build targeted account list for outbound
TokenGoblin,Token Efficiency Review,AI ops teams/procurement/dev teams using LLMs,4,3,4,5,5,4,2,4,3,Content marketing + free tier,Publish token waste case studies
FindingNemos,Local AI Operator Substrate,Technical founders/AI labs/agent builders,3,2,3,2,2,3,4,3,2,Community-driven open source,Stabilize core and get verified build
FlexibleAccessible,Accessibility Monitoring,SMB websites/agencies/educational/ecommerce,3,3,3,1,1,2,3,2,2,Needs product definition,Conduct customer discovery interviews
Hardonia,Ecommerce Automation,Ecommerce store owners/marketplace operators,3,3,3,1,1,2,3,2,2,Needs product definition,Conduct customer discovery interviews
MEL,Incident Intelligence/Trusted Control OS,Field ops/emergency/infrastructure/IoT operators,4,4,3,1,1,2,3,2,3,Needs product definition,Conduct customer discovery interviews
Nautilus,AI Substrate/Control Plane,Technical founders/AI labs/agent builders/dev tool users,3,2,3,3,3,3,4,3,3,Developer-focused content + OSS,Improve docs and get first external contributor
Requiem/Zeo,AI Control Plane/Agent Governance,Technical founders building agent systems,2,2,2,1,1,1,3,3,2,1,Needs product definition,Conduct customer discovery interviews